{
  "schema_version": 0,
  "symbol": "NVDA",
  "as_of": "2026-06-01T12:00:00Z",
  "build_id": "example-local-001",
  "window": "1y",
  "currency": "USD",
  "series": {
    "source": "mosaic_themes/market_cap_indexed",
    "dates": ["2025-06-03", "2025-07-01", "2025-08-01", "2025-09-02", "2025-10-01", "2025-11-03", "2025-12-01", "2026-01-02", "2026-02-02", "2026-03-03", "2026-04-01", "2026-05-01", "2026-06-01"],
    "values": [100, 108.2, 112.5, 105.1, 118.4, 125.0, 130.2, 128.9, 135.6, 142.1, 138.0, 145.5, 152.3],
    "spy_values": [100, 101.2, 102.0, 100.5, 103.1, 104.8, 106.0, 105.2, 107.0, 108.5, 107.2, 109.0, 110.1]
  }
}
